{
  "schema_version": "2.0.0",
  "profile": "LINUX-ONESHOT-PACKAGE-V2",
  "id": "63000000-0000-4000-8000-000000000001",
  "created_at": "2026-08-06T01:10:00Z",
  "source": "collector",
  "producer_name": "sec-ai-linux-one-shot",
  "producer_version": "0.1.0",
  "correlation_id": "61000000-0000-4000-8000-000000000002",
  "organization_id": "61000000-0000-4000-8000-000000000003",
  "subject_user_id": "61000000-0000-4000-8000-000000000004",
  "job_id": "61000000-0000-4000-8000-000000000005",
  "asset_id": "61000000-0000-4000-8000-000000000006",
  "manifest_id": "61000000-0000-4000-8000-000000000001",
  "manifest_hash": "aaaaaaaaaaaaaaaaaaaaaaaaaaaaaaaaaaaaaaaaaaaaaaaaaaaaaaaaaaaaaaaa",
  "nonce": "LinuxOneShotNonceExample0001",
  "execution_attempt_id": "61000000-0000-4000-8000-000000000007",
  "issued_at": "2026-08-06T01:00:00Z",
  "expires_at": "2026-08-06T01:30:00Z",
  "collector": {
    "name": "sec-ai-linux-one-shot",
    "version": "0.1.0",
    "build_sha256": "ffffffffffffffffffffffffffffffffffffffffffffffffffffffffffffffff",
    "probe_bundle_sha256": "bbbbbbbbbbbbbbbbbbbbbbbbbbbbbbbbbbbbbbbbbbbbbbbbbbbbbbbbbbbbbbbb",
    "release_channel": "DEV-UNTRUSTED"
  },
  "host": {"os_family": "LINUX", "distribution": "UBUNTU_24_04", "version_id": "24.04", "architecture": "x86_64", "timezone": "UTC", "clock_status": "UNKNOWN"},
  "archive": {"format": "ZIP-STORED-OR-DEFLATE", "archive_sha256": "1111111111111111111111111111111111111111111111111111111111111111", "content_set_sha256": "2222222222222222222222222222222222222222222222222222222222222222", "compressed_bytes": 512, "uncompressed_bytes": 1024, "file_count": 2},
  "file_inventory": [
    {"path": "collector_manifest.json", "media_type": "application/json", "size_bytes": 400, "sha256": "3333333333333333333333333333333333333333333333333333333333333333"},
    {"path": "evidence/62000000-0000-4000-8000-000000000001.json", "media_type": "application/json", "size_bytes": 500, "sha256": "4444444444444444444444444444444444444444444444444444444444444444"}
  ],
  "evidence_records": [{
    "evidence_id": "62000000-0000-4000-8000-000000000001",
    "probe_id": "linux.os-release",
    "probe_version": "1.0.0",
    "control_ids": ["U-01"],
    "required_privilege": "STANDARD_USER",
    "collection_status": "COLLECTED",
    "error_code": "NONE",
    "member_path": "evidence/62000000-0000-4000-8000-000000000001.json",
    "output_sha256": "dddddddddddddddddddddddddddddddddddddddddddddddddddddddddddddddd",
    "evidence_sha256": "4444444444444444444444444444444444444444444444444444444444444444",
    "redacted": false
  }],
  "authentication": {"profile": "OFFLINE-USER-SUBMITTED", "assurance_level": "LOW"}
}
